[
    {
        "name": "Shanghai",
        "lat": 31.22222,
        "lng": 121.45806,
        "pop": 24874500,
        "slug": "shanghai"
    },
    {
        "name": "Beijing",
        "lat": 39.9075,
        "lng": 116.39723,
        "pop": 18960744,
        "slug": "beijing"
    },
    {
        "name": "Shenzhen",
        "lat": 22.54554,
        "lng": 114.0683,
        "pop": 17494398,
        "slug": "shenzhen"
    },
    {
        "name": "Guangzhou",
        "lat": 23.11667,
        "lng": 113.25,
        "pop": 16096724,
        "slug": "guangzhou"
    },
    {
        "name": "Kinshasa",
        "lat": -4.32758,
        "lng": 15.31357,
        "pop": 16000000,
        "slug": "kinshasa"
    },
    {
        "name": "Istanbul",
        "lat": 41.01384,
        "lng": 28.94966,
        "pop": 15701602,
        "slug": "istanbul"
    },
    {
        "name": "Lagos",
        "lat": 6.45407,
        "lng": 3.39467,
        "pop": 15388000,
        "slug": "lagos"
    },
    {
        "name": "Ho Chi Minh City",
        "lat": 10.82302,
        "lng": 106.62965,
        "pop": 14002598,
        "slug": "ho-chi-minh-city"
    },
    {
        "name": "Chengdu",
        "lat": 30.66667,
        "lng": 104.06667,
        "pop": 13568357,
        "slug": "chengdu"
    },
    {
        "name": "Lahore",
        "lat": 31.558,
        "lng": 74.35071,
        "pop": 13004135,
        "slug": "lahore"
    },
    {
        "name": "Mumbai",
        "lat": 19.07283,
        "lng": 72.88261,
        "pop": 12691836,
        "slug": "mumbai"
    },
    {
        "name": "São Paulo",
        "lat": -23.5475,
        "lng": -46.63611,
        "pop": 12400232,
        "slug": "sao-paulo"
    },
    {
        "name": "Mexico City",
        "lat": 19.42847,
        "lng": -99.12766,
        "pop": 12294193,
        "slug": "mexico-city"
    },
    {
        "name": "Karachi",
        "lat": 24.8608,
        "lng": 67.0104,
        "pop": 11624219,
        "slug": "karachi"
    },
    {
        "name": "Tianjin",
        "lat": 39.14222,
        "lng": 117.17667,
        "pop": 11090314,
        "slug": "tianjin"
    },
    {
        "name": "Delhi",
        "lat": 28.65195,
        "lng": 77.23149,
        "pop": 11034555,
        "slug": "delhi"
    },
    {
        "name": "Wuhan",
        "lat": 30.58333,
        "lng": 114.26667,
        "pop": 10392693,
        "slug": "wuhan"
    },
    {
        "name": "Moscow",
        "lat": 55.75204,
        "lng": 37.61781,
        "pop": 10381222,
        "slug": "moscow"
    },
    {
        "name": "Dhaka",
        "lat": 23.7104,
        "lng": 90.40744,
        "pop": 10356500,
        "slug": "dhaka"
    },
    {
        "name": "Seoul",
        "lat": 37.566,
        "lng": 126.9784,
        "pop": 10349312,
        "slug": "seoul"
    },
    {
        "name": "Tokyo",
        "lat": 35.6895,
        "lng": 139.69171,
        "pop": 9733276,
        "slug": "tokyo"
    },
    {
        "name": "Dongguan",
        "lat": 23.01797,
        "lng": 113.74866,
        "pop": 9644871,
        "slug": "dongguan"
    },
    {
        "name": "Cairo",
        "lat": 30.06263,
        "lng": 31.24967,
        "pop": 9606916,
        "slug": "cairo"
    },
    {
        "name": "Xi’an",
        "lat": 34.25833,
        "lng": 108.92861,
        "pop": 9600000,
        "slug": "xi-an"
    },
    {
        "name": "Johannesburg",
        "lat": -26.20227,
        "lng": 28.04363,
        "pop": 9418183,
        "slug": "johannesburg"
    },
    {
        "name": "Nanjing",
        "lat": 32.06167,
        "lng": 118.77778,
        "pop": 9314685,
        "slug": "nanjing"
    },
    {
        "name": "Hangzhou",
        "lat": 30.29365,
        "lng": 120.16142,
        "pop": 9236032,
        "slug": "hangzhou"
    },
    {
        "name": "Foshan",
        "lat": 23.02677,
        "lng": 113.13148,
        "pop": 9042509,
        "slug": "foshan"
    },
    {
        "name": "London",
        "lat": 51.50853,
        "lng": -0.12574,
        "pop": 8961989,
        "slug": "london"
    },
    {
        "name": "New York City",
        "lat": 40.71427,
        "lng": -74.00597,
        "pop": 8804190,
        "slug": "new-york-city"
    },
    {
        "name": "Jakarta",
        "lat": -6.21462,
        "lng": 106.84513,
        "pop": 8540121,
        "slug": "jakarta"
    },
    {
        "name": "Bengaluru",
        "lat": 12.97194,
        "lng": 77.59369,
        "pop": 8495492,
        "slug": "bengaluru"
    },
    {
        "name": "Hanoi",
        "lat": 21.0245,
        "lng": 105.84117,
        "pop": 8053663,
        "slug": "hanoi"
    },
    {
        "name": "Taipei",
        "lat": 25.05306,
        "lng": 121.52639,
        "pop": 7871900,
        "slug": "taipei"
    },
    {
        "name": "Lima",
        "lat": -12.04318,
        "lng": -77.02824,
        "pop": 7737002,
        "slug": "lima"
    },
    {
        "name": "Bogotá",
        "lat": 4.60971,
        "lng": -74.08175,
        "pop": 7674366,
        "slug": "bogota"
    },
    {
        "name": "Chongqing",
        "lat": 29.56026,
        "lng": 106.55771,
        "pop": 7457599,
        "slug": "chongqing"
    },
    {
        "name": "Hong Kong",
        "lat": 22.27832,
        "lng": 114.17469,
        "pop": 7396076,
        "slug": "hong-kong"
    },
    {
        "name": "Baghdad",
        "lat": 33.34058,
        "lng": 44.40088,
        "pop": 7216000,
        "slug": "baghdad"
    },
    {
        "name": "Wuzhong",
        "lat": 37.9867,
        "lng": 106.201,
        "pop": 7202654,
        "slug": "wuzhong"
    },
    {
        "name": "Qingdao",
        "lat": 36.06488,
        "lng": 120.38042,
        "pop": 7172451,
        "slug": "qingdao"
    },
    {
        "name": "Tehran",
        "lat": 35.69439,
        "lng": 51.42151,
        "pop": 7153309,
        "slug": "tehran"
    },
    {
        "name": "Shenyang",
        "lat": 41.79222,
        "lng": 123.43278,
        "pop": 7050000,
        "slug": "shenyang"
    },
    {
        "name": "Hyderabad",
        "lat": 17.38405,
        "lng": 78.45636,
        "pop": 6993262,
        "slug": "hyderabad"
    },
    {
        "name": "Rio de Janeiro",
        "lat": -22.90642,
        "lng": -43.18223,
        "pop": 6747815,
        "slug": "rio-de-janeiro"
    },
    {
        "name": "Suzhou",
        "lat": 31.30408,
        "lng": 120.59538,
        "pop": 6715559,
        "slug": "suzhou"
    },
    {
        "name": "Ahmedabad",
        "lat": 23.02579,
        "lng": 72.58727,
        "pop": 6357693,
        "slug": "ahmedabad"
    },
    {
        "name": "Abidjan",
        "lat": 5.35444,
        "lng": -4.00167,
        "pop": 6321017,
        "slug": "abidjan"
    },
    {
        "name": "Pudong",
        "lat": 31.23995,
        "lng": 121.50094,
        "pop": 5681512,
        "slug": "pudong"
    },
    {
        "name": "Singapore",
        "lat": 1.28967,
        "lng": 103.85007,
        "pop": 5638700,
        "slug": "singapore"
    },
    {
        "name": "Sydney",
        "lat": -33.86785,
        "lng": 151.20732,
        "pop": 5557233,
        "slug": "sydney"
    },
    {
        "name": "Dar es Salaam",
        "lat": -6.82349,
        "lng": 39.26951,
        "pop": 5383728,
        "slug": "dar-es-salaam"
    },
    {
        "name": "Saint Petersburg",
        "lat": 59.93863,
        "lng": 30.31413,
        "pop": 5351935,
        "slug": "saint-petersburg"
    },
    {
        "name": "Melbourne",
        "lat": -37.814,
        "lng": 144.96332,
        "pop": 5350705,
        "slug": "melbourne"
    },
    {
        "name": "Alexandria",
        "lat": 31.20176,
        "lng": 29.91582,
        "pop": 5263542,
        "slug": "alexandria"
    },
    {
        "name": "Harbin",
        "lat": 45.75,
        "lng": 126.65,
        "pop": 5242897,
        "slug": "harbin"
    },
    {
        "name": "Bangkok",
        "lat": 13.75398,
        "lng": 100.50144,
        "pop": 5104476,
        "slug": "bangkok"
    },
    {
        "name": "Hefei",
        "lat": 31.86389,
        "lng": 117.28083,
        "pop": 5050000,
        "slug": "hefei"
    },
    {
        "name": "Dalian",
        "lat": 38.91222,
        "lng": 121.60222,
        "pop": 4913879,
        "slug": "dalian"
    },
    {
        "name": "Kano",
        "lat": 12.00012,
        "lng": 8.51672,
        "pop": 4910000,
        "slug": "kano"
    },
    {
        "name": "Santiago",
        "lat": -33.45694,
        "lng": -70.64827,
        "pop": 4837295,
        "slug": "santiago"
    },
    {
        "name": "Cape Town",
        "lat": -33.92584,
        "lng": 18.42322,
        "pop": 4772846,
        "slug": "cape-town"
    },
    {
        "name": "Peshawar",
        "lat": 34.008,
        "lng": 71.57849,
        "pop": 4758762,
        "slug": "peshawar"
    },
    {
        "name": "Changchun",
        "lat": 43.88,
        "lng": 125.32278,
        "pop": 4714996,
        "slug": "changchun"
    },
    {
        "name": "Jeddah",
        "lat": 21.49012,
        "lng": 39.18624,
        "pop": 4697000,
        "slug": "jeddah"
    },
    {
        "name": "Chennai",
        "lat": 13.08784,
        "lng": 80.27847,
        "pop": 4681087,
        "slug": "chennai"
    },
    {
        "name": "Kolkata",
        "lat": 22.56263,
        "lng": 88.36304,
        "pop": 4631392,
        "slug": "kolkata"
    },
    {
        "name": "Xiamen",
        "lat": 24.47979,
        "lng": 118.08187,
        "pop": 4617251,
        "slug": "xiamen"
    },
    {
        "name": "Surat",
        "lat": 21.19594,
        "lng": 72.83023,
        "pop": 4591246,
        "slug": "surat"
    },
    {
        "name": "Yangon",
        "lat": 16.80528,
        "lng": 96.15611,
        "pop": 4477638,
        "slug": "yangon"
    },
    {
        "name": "Bao'an",
        "lat": 22.55213,
        "lng": 113.88288,